{
  "schema_version": "source-sequence-review.v1",
  "review_id": "xhs:67df9871000000001e0043b1:snapshot-95b77bb26104:note-desc-20:sequence-v1:review-1",
  "manifest_id": "xhs:67df9871000000001e0043b1:snapshot-95b77bb26104:note-desc-20:sequence-v1",
  "manifest_sha256": "5762a3e825bfe0e82add2d7ab8c3e5385053eee2a90595324322b60fcc8243d8",
  "decision": "approved",
  "reviewed_at": "2026-09-17T04:04:39Z",
  "reviewer_kind": "ai-assisted",
  "review_evidence": {
    "repository": "liqiangcc/interview-lab",
    "issue_number": 2019,
    "comment_id": 5708294685
  },
  "checks": [
    {
      "check_id": "evidence_stream_binding",
      "result": "pass"
    },
    {
      "check_id": "sequence_scope",
      "result": "pass"
    },
    {
      "check_id": "unit_boundaries",
      "result": "pass"
    },
    {
      "check_id": "unit_order",
      "result": "pass"
    },
    {
      "check_id": "unit_types",
      "result": "pass"
    },
    {
      "check_id": "fragment_boundaries",
      "result": "pass"
    },
    {
      "check_id": "fragment_order",
      "result": "pass"
    },
    {
      "check_id": "no_fabrication",
      "result": "pass"
    }
  ],
  "limitations": [
    "Approval covers only the exact manifest_id + manifest_sha256 pair.",
    "text_projection fidelity to the Raw artifact was not re-verified; readable_projection.review_status remains unreviewed.",
    "source_projection remains Source-derived readable evidence and does not become Raw by inclusion in the Manifest.",
    "Approval does not authorize SourceQuestion, CanonicalQuestion, Analysis, Answer, outcome, or result mutation."
  ],
  "supersedes_review_id": null
}
